{
  "$schema": "./config.schema.json",
  "schemaVersion": 1,
  "repositories": {
    "roots": ["~/dev"],
    "priority": []
  },
  "terminal": {
    "defaultTarget": "local",
    "remoteHost": null,
    "localSession": "main",
    "remoteSession": "main"
  },
  "ui": {
    "statusMonitor": true,
    "windowPrefix": true
  },
  "notifications": {
    "native": true
  }
}
